{
  "partner_id": "hdfc-bank",
  "product_code": "rural-housing-loan",
  "product_family": "RURAL_HOUSING",
  "product_name_official": "Rural Housing Loans",
  "product_summary": "Specialized home financing for agriculturists, planters, horticulturists, dairy farmers, and fish farmers to purchase residential properties in rural or urban areas. Also available to salaried and self-employed individuals.",
  "source_url": "https://homeloans.hdfc.bank.in/housing-loans/rural-housing-loans",
  "scraped_at": "2026-04-27",
  "review_status": "pending",
  "review_notes": null,
  "eligibility": {
    "entity_types": ["Agriculturists", "Planters", "Horticulturists", "Dairy Farmers", "Fish Farmers", "Salaried individuals", "Self-employed professionals", "Self-employed non-professionals"],
    "min_age": 18,
    "max_age": 70,
    "salaried_min_income_inr_monthly": null,
    "self_employed_min_income_inr_annual": null,
    "min_business_vintage_years": null,
    "min_itr_years": null,
    "min_credit_score": null,
    "geographies": ["Rural areas", "Urban areas", "All-India coverage"]
  },
  "pricing": {
    "roi_min_pct": 8.4,
    "roi_max_pct": 13.2,
    "roi_basis": "Policy Repo Rate + 2.90% to 7.70% (PRR currently 5.25%)",
    "processing_fee_pct_min": 0.5,
    "processing_fee_pct_max": 1.5,
    "processing_fee_flat_inr": 4000,
    "foreclosure_charges_pct": 2.0,
    "prepayment_charges_pct": 2.0,
    "other_charges_notes": "Stamp duty, regulatory charges, administrative fees at actuals. Senior citizens receive 10% discount on service charges."
  },
  "loan_structure": {
    "ltv_pct_max": 90,
    "tenure_months_min": 12,
    "tenure_months_max": 360,
    "ticket_inr_min": 100000,
    "ticket_inr_max": 1000000000
  },
  "collateral_accepted": ["Security interest on financed property", "Agricultural land (for agriculturists, no mandatory mortgage required)", "Other collateral as required by bank"],
  "documents_required": [
    "PAN Card or Form 60",
    "Identity proof (Passport, Driving License, Voter ID, NREGA card, NPR letter, Aadhaar)",
    "Address proof (same documents as identity)",
    "Title documents of agricultural land (for agriculturists)",
    "Proof of crops cultivated (for agriculturists)",
    "Last 6 months bank statements",
    "Last 3 months salary slips (salaried)",
    "Form-16 and IT returns (salaried)",
    "IT returns for last 2 assessment years with CA attestation (self-employed)",
    "Last 2 years Balance Sheet and P&L with CA attestation (self-employed)",
    "Last 12 months current/savings account statements (self-employed)",
    "Own contribution proof",
    "Employment contract/appointment letter (if less than 1 year employment)",
    "Last 6 months loan repayment statements",
    "Passport size photographs",
    "Processing fee cheque",
    "Last 2 years loan statements",
    "Form 26AS (self-employed)",
    "Business profile documents (self-employed)",
    "Director/shareholder details (if company)",
    "Partnership deed (if partnership)"
  ],
  "turnaround_days": { "sanction": null, "disbursal": null },
  "key_features": [
    "Customized repayment options tailored to requirements",
    "Minimal documentation required",
    "24/7 customer support via chat and WhatsApp",
    "Online loan account management",
    "No mandatory agricultural land mortgage for agriculturists",
    "Extended 20-year tenure option for agriculturists",
    "No mandatory ITR requirement for agriculturists",
    "Purchase of under-construction, new, or existing residential properties",
    "Home construction on freehold or leasehold plots",
    "Home renovation and extension financing available",
    "Available for both rural and urban properties",
    "Floating and fixed rate options",
    "Online application and approval process",
    "Pre-verified properties database access",
    "EMI, eligibility, and affordability calculators available",
    "Higher loan eligibility with co-applicants",
    "Competitive interest rates benchmarked to policy repo rate",
    "No hidden charges transparency"
  ],
  "fees_table_raw": "Processing: 0.5-1.5% of loan amount or ₹4,000-₹5,000 minimum + taxes. Conversion: 0.5% or ₹3,000 (first) / ₹2,000 (subsequent), minimum. Premature closure: 2% + taxes for fixed rate loans (except own sources). Payment return: ₹450. Property document retention: ₹1,000/month after 2 months from closure. Stamp duty and regulatory charges at actuals. Senior citizens: 10% discount on service charges.",
  "data_quality": {
    "completeness_pct": 0.82,
    "fields_missing": ["eligibility.income_thresholds", "eligibility.min_itr_years", "turnaround_days"]
  }
}
