{
  "partner_id": "hdfc-bank",
  "product_code": "home-loan",
  "product_family": "HOME_LOAN",
  "product_name_official": "Home Loans",
  "product_summary": "HDFC Bank Home Loans provide financing for purchase of residential properties, construction on owned plots, and property improvements. Loans available up to ₹10 Crore with flexible repayment options.",
  "source_url": "https://homeloans.hdfc.bank.in/housing-loans/home-loans",
  "scraped_at": "2026-04-27",
  "review_status": "pending",
  "review_notes": null,
  "eligibility": {
    "entity_types": ["Individual", "Salaried", "Self-Employed Professional", "Self-Employed Non-Professional"],
    "min_age": 21,
    "max_age": 70,
    "salaried_min_income_inr_monthly": 10000,
    "self_employed_min_income_inr_annual": 200000,
    "min_business_vintage_years": null,
    "min_itr_years": 2,
    "min_credit_score": null,
    "geographies": ["India", "Resident Indian", "NRI locations including UK"]
  },
  "pricing": {
    "roi_min_pct": 7.75,
    "roi_max_pct": 13.20,
    "roi_basis": "Policy Repo Rate + 2.50% to 7.95%",
    "processing_fee_pct_min": 0.50,
    "processing_fee_pct_max": 1.50,
    "processing_fee_flat_inr": 4000,
    "foreclosure_charges_pct": 2.0,
    "prepayment_charges_pct": 2.0,
    "other_charges_notes": "Fixed rate loans: 2% prepayment charge plus taxes. Adjustable/floating rate: nil prepayment charges. Conversion fee up to 0.50% or ₹3000 whichever is lower. Property document retention: ₹1000/month after 60 days from closure."
  },
  "loan_structure": {
    "ltv_pct_max": 90.0,
    "tenure_months_min": 12,
    "tenure_months_max": 360,
    "ticket_inr_min": 100000,
    "ticket_inr_max": 1000000000
  },
  "collateral_accepted": ["Residential property being financed", "Other collateral/interim security as required"],
  "documents_required": [
    "PAN Card or Form 60",
    "Passport/Driving License/Voter ID/NREGA Job Card/NPR Letter/Aadhaar",
    "Address Proof (official government document)",
    "Last 3 months salary slips",
    "Last 6 months bank statements",
    "Latest Form-16 and IT returns",
    "Income Tax Returns (last 2 assessment years)",
    "Balance Sheet and Profit & Loss statements (last 2 years for self-employed)",
    "Last 12 months current account statements",
    "Title deeds and property documents",
    "Allotment letter or buyer agreement",
    "Payment receipts to developer/seller",
    "Agreement to sell",
    "Approved construction plans",
    "Construction estimate by architect",
    "Own contribution proof",
    "Employment contract/appointment letter",
    "Passport size photographs",
    "Processing fee cheque",
    "Business profile (for self-employed)",
    "Form 26AS",
    "Directors/shareholders list (for companies)",
    "Memorandum and Articles of Association",
    "Partnership deed (if applicable)",
    "Details of ongoing loans"
  ],
  "turnaround_days": { "sanction": null, "disbursal": null },
  "key_features": [
    "Loans up to ₹10 Crore",
    "End-to-end digital application process",
    "4-step quick approval",
    "Minimal documentation required",
    "Multiple repayment options: Standing instructions, ECS, employer deduction, post-dated cheques",
    "Customized repayment plans including SURF (Step Up Repayment Facility)",
    "FLIP (Flexible Loan Installments Plan) for varying repayment capacity",
    "Tranche-based EMI for under-construction properties",
    "Accelerated repayment scheme",
    "Financing for new construction, resale, plot purchase, home renovation, and extension",
    "Co-applicant facility for higher eligibility",
    "24/7 customer support via chat, WhatsApp, phone",
    "Online loan account management",
    "Tax benefits under sections 80C, 24(b), 80EEA of Income Tax Act",
    "Pre-approved loans valid for 6 months",
    "Expert legal and technical counseling",
    "Nationwide branch network for servicing",
    "Variable and fixed rate options",
    "Combination rate loans (part fixed, part floating)",
    "Balance transfer facility from other lenders",
    "Special rates for salaried and self-employed professionals",
    "HDFC Reach Scheme for micro-entrepreneurs",
    "PMAY (Urban) 2.0 - Interest Subsidy Scheme support",
    "NRI housing loan options",
    "Senior citizen discount on service charges (10%)"
  ],
  "fees_table_raw": "Processing Fee: Salaried/Self-Employed Professional - 0.50% of loan or ₹4,000 (whichever higher); Self-Employed Non-Professional - 1.50% or ₹5,000 (whichever higher). Conversion to lower rate variable: 0.50% or ₹3,000 (whichever lower) for first conversion, then ₹2,000 (whichever lower). Prepayment charges: Fixed rate 2% + taxes; Adjustable rate nil. Premature closure fixed rate: 2% + taxes except own sources. Payment return: ₹450. Custody charges: ₹1,000/month after 2 months from closure. Administrative charges: ₹5,000 + taxes. Re-appraisal after 6 months: ₹3,300-₹5,000.",
  "data_quality": {
    "completeness_pct": 0.95,
    "fields_missing": ["turnaround_days.sanction", "turnaround_days.disbursal", "eligibility.min_credit_score"]
  }
}
