{
  "partner_id": "hdfc-bank",
  "product_code": "home-renovation-loan",
  "product_family": "RENOVATION",
  "product_name_official": "House Renovation Loans",
  "product_summary": "Loan facility to spruce up and renovate existing homes including tiling, flooring, internal/external plaster and painting. Available for both existing and new customers at home loan interest rates.",
  "source_url": "https://homeloans.hdfc.bank.in/housing-loans/home-renovation-loans",
  "scraped_at": "2026-04-27",
  "review_status": "pending",
  "review_notes": null,
  "eligibility": {
    "entity_types": ["Individual"],
    "min_age": 18,
    "max_age": 70,
    "salaried_min_income_inr_monthly": null,
    "self_employed_min_income_inr_annual": null,
    "min_business_vintage_years": null,
    "min_itr_years": 2,
    "min_credit_score": null,
    "geographies": ["Resident Indian"]
  },
  "pricing": {
    "roi_min_pct": 7.75,
    "roi_max_pct": 13.2,
    "roi_basis": "Policy Repo Rate + 2.50% to 7.95%",
    "processing_fee_pct_min": 0.5,
    "processing_fee_pct_max": 1.5,
    "processing_fee_flat_inr": 4000,
    "foreclosure_charges_pct": 2.0,
    "prepayment_charges_pct": 2.0,
    "other_charges_notes": "Fixed Rate Loans: 2% prepayment charges plus applicable taxes except for own sources. Variable Rate Loans: Nil prepayment charges. Processing fee non-refundable. Senior citizens eligible for 10% discount on service charges."
  },
  "loan_structure": {
    "ltv_pct_max": 100,
    "tenure_months_min": 12,
    "tenure_months_max": 180,
    "ticket_inr_min": null,
    "ticket_inr_max": null
  },
  "collateral_accepted": ["Security interest on property being financed", "Other collateral/interim security as required"],
  "documents_required": [
    "PAN Card or Form 60",
    "Identity Proof (Passport/Driving License/Voter ID/NREGA card/NPR letter/Aadhaar)",
    "Address Proof (any OVD)",
    "Salary slips (last 3 months for salaried)",
    "Bank statements (last 6 months)",
    "Form-16 and IT returns",
    "Income Tax Returns (last 2 assessment years)",
    "Balance Sheet and P&L statements (last 2 years for self-employed)",
    "Current account statements (business entity)",
    "Title deeds of property",
    "Proof of no encumbrances",
    "Renovation estimate from architect/civil engineer",
    "Own contribution proof",
    "Employment contract/appointment letter",
    "Bank statements showing loan repayment history",
    "Passport size photographs",
    "Processing fee cheque",
    "Business profile documents",
    "Form 26AS",
    "Directors/shareholders list",
    "MOA/AOA or partnership deed"
  ],
  "turnaround_days": { "sanction": null, "disbursal": null },
  "key_features": [
    "Loan approval in 4 simple steps",
    "End-to-end digital process available",
    "Interest rates same as home loans",
    "Customized repayment options",
    "Easy documentation with minimal requirements",
    "24x7 customer assistance via chat and WhatsApp",
    "Online loan account management",
    "Available for both existing and new customers",
    "Simple monthly installment repayments",
    "Tax benefits on principal under Income Tax Act 1961",
    "Can fund immovable furniture and fixtures",
    "Disbursement in installments based on renovation progress"
  ],
  "fees_table_raw": "Processing Fee: 0.50%-1.50% of loan amount or Rs. 4,000-5,000 minimum (varies by category), non-refundable. Re-appraisal after 6 months: Rs. 3,300-5,000. Conversion fee (floating to fixed): Rs. 3,000. Document copies: Rs. 500. Repayment mode change: Rs. 500. Prepayment (Fixed Rate): 2% of amount prepaid plus taxes. Prepayment (Variable Rate): Nil. Property document retention: Rs. 1,000/month after 60 days from closure. Payment return charges: Rs. 450. Administrative charges: Rs. 5,000 plus taxes.",
  "data_quality": {
    "completeness_pct": 0.83,
    "fields_missing": ["loan_structure.ticket_inr_min", "loan_structure.ticket_inr_max", "turnaround_days"]
  }
}
