{
  "partner_id": "hdfc-bank",
  "product_code": "plot-loan",
  "product_family": "PLOT_LOAN",
  "product_name_official": "Plot Loans",
  "product_summary": "HDFC Bank's Plot Loans facilitate the acquisition of land for constructing your dream home. These loans support purchase of plots through direct allotment or resale.",
  "source_url": "https://homeloans.hdfc.bank.in/housing-loans/plot-loans",
  "scraped_at": "2026-04-27",
  "review_status": "pending",
  "review_notes": null,
  "eligibility": {
    "entity_types": ["Salaried", "Self Employed Professional", "Self Employed Non-Professional"],
    "min_age": 18,
    "max_age": 70,
    "salaried_min_income_inr_monthly": null,
    "self_employed_min_income_inr_annual": null,
    "min_business_vintage_years": null,
    "min_itr_years": 2,
    "min_credit_score": null,
    "geographies": ["Resident Indian"]
  },
  "pricing": {
    "roi_min_pct": 7.75,
    "roi_max_pct": 13.2,
    "roi_basis": "Policy Repo Rate + 2.50% to 7.95%",
    "processing_fee_pct_min": 0.5,
    "processing_fee_pct_max": 1.5,
    "processing_fee_flat_inr": 4000,
    "foreclosure_charges_pct": 2.0,
    "prepayment_charges_pct": 2.0,
    "other_charges_notes": "Stamp duty, CERSAI charges, legal verification charges, administrative charges up to Rs.5000 applicable. Senior citizens get 10% discount on service charges."
  },
  "loan_structure": {
    "ltv_pct_max": 80.0,
    "tenure_months_min": 12,
    "tenure_months_max": 180,
    "ticket_inr_min": 100000,
    "ticket_inr_max": 1000000000
  },
  "collateral_accepted": ["First mortgage on the property being financed", "Additional collateral/interim security as required"],
  "documents_required": [
    "PAN Card or Form 60",
    "Passport/Driving License/Voter ID/NREGA Job Card/NPR Letter/Aadhaar",
    "Last 3 months salary slips (salaried)",
    "Last 6 months bank statements showing salary credits",
    "Latest Form-16 and IT returns",
    "Income returns with computation for 2 AYs with CA attestation (self-employed)",
    "Last 2 years balance sheet and P&L with CA attestation (self-employed)",
    "Last 12 months current account statements (self-employed)",
    "Allotment letter or buyer agreement",
    "Title deeds and property chain documents (resale)",
    "Own contribution proof",
    "Employment contract/appointment letter if <1 year tenure",
    "Last 6 months bank statements showing loan repayments",
    "Passport photographs",
    "Processing fee cheque",
    "Business profile documents (self-employed)",
    "Form 26AS (self-employed)",
    "Director/shareholder list (company)",
    "MOA/AOA (company)",
    "Partnership deed (partnership)",
    "List of ongoing loans with details"
  ],
  "turnaround_days": { "sanction": null, "disbursal": null },
  "key_features": [
    "End-to-end digital process with approval in 4 steps",
    "Loans for direct allotment plots",
    "Loans for resale plots",
    "Loan balance transfer facility from other institutions",
    "Loans for construction on freehold/leasehold plots",
    "Customized repayment options",
    "24/7 customer support via chat/WhatsApp",
    "Online loan account management",
    "Expert legal and technical counseling",
    "No hidden charges",
    "Competitive interest rates",
    "Tenure up to 15 years",
    "Up to 80% LTV for loans up to Rs.75 lakhs"
  ],
  "fees_table_raw": "Processing Fee: 0.50%-1.50% of loan amount or Rs.4000-5000 flat (whichever higher) plus taxes. Conversion Fee: Up to 0.50% or Rs.3000 (whichever lower) for floating rate switch. Premature Closure: 2% + taxes on fixed rate loans. Administrative Charges: Up to Rs.5000 + taxes. Stamp Duty, CERSAI, Legal Verification: At actuals. Payment Return: Rs.450. Repayment Mode Change: Rs.500. Property Document Custody: Rs.1000/month after 2 months from closure.",
  "data_quality": {
    "completeness_pct": 0.85,
    "fields_missing": ["eligibility.salaried_min_income_inr_monthly", "eligibility.self_employed_min_income_inr_annual", "turnaround_days"]
  }
}
