{
  "partner_id": "hdfc-bank",
  "product_code": "home-loan-balance-transfer",
  "product_family": "HOME_LOAN_BT",
  "product_name_official": "Home Loan Balance Transfer",
  "product_summary": "Transfer outstanding home loan balance from another bank to HDFC Bank at attractive interest rates with lower EMIs. Option to avail additional top-up loan up to ₹100 lakhs.",
  "source_url": "https://homeloans.hdfc.bank.in/home-loan-balance-transfer",
  "scraped_at": "2026-04-27",
  "review_status": "pending",
  "review_notes": null,
  "eligibility": {
    "entity_types": ["Resident Indian", "Salaried", "Self-Employed Professional", "Self-Employed Non-Professional"],
    "min_age": 18,
    "max_age": 70,
    "salaried_min_income_inr_monthly": null,
    "self_employed_min_income_inr_annual": null,
    "min_business_vintage_years": null,
    "min_itr_years": 2,
    "min_credit_score": null,
    "geographies": ["India"]
  },
  "pricing": {
    "roi_min_pct": 7.75,
    "roi_max_pct": 13.20,
    "roi_basis": "Policy Repo Rate + 2.50% to 7.95%",
    "processing_fee_pct_min": 0.50,
    "processing_fee_pct_max": 1.50,
    "processing_fee_flat_inr": 4000,
    "foreclosure_charges_pct": 2.0,
    "prepayment_charges_pct": 2.0,
    "other_charges_notes": "Conversion fees: 0.50% to 1.50% of principal outstanding; Miscellaneous charges at actuals; Re-appraisal fee ₹3,300-₹5,000; Administrative charges up to ₹5,000"
  },
  "loan_structure": {
    "ltv_pct_max": 90.0,
    "tenure_months_min": 12,
    "tenure_months_max": 360,
    "ticket_inr_min": 100000,
    "ticket_inr_max": 1000000000
  },
  "collateral_accepted": ["Mortgage on property being financed", "Other collateral as required by HDFC Bank"],
  "documents_required": [
    "PAN Card or Form 60",
    "Passport/Driving License/Voter ID/NREGA card/NPR letter/Aadhaar",
    "Address proof (utility bills, rental agreement)",
    "Salary slips (3 months)",
    "Bank statements (6 months for salaried; 12 months for business)",
    "Form 16 and IT returns",
    "Income Tax Returns (2 years)",
    "Balance Sheet and P&L statements (2 years for self-employed)",
    "Current account statements",
    "Outstanding balance letter from existing lender",
    "Property documents photocopy",
    "Own contribution proof",
    "Employment letter (if <1 year tenure)",
    "Passport photographs",
    "Cheque for processing fee",
    "Form 26 AS (latest)",
    "Directors/shareholders list and shareholding details",
    "Memorandum and Articles of Association",
    "Partnership deed (if applicable)"
  ],
  "turnaround_days": { "sanction": null, "disbursal": null },
  "key_features": [
    "End-to-end digital application process",
    "Home loan approval in 4 simple steps",
    "Customized repayment options (SURF, FLIP, Accelerated Repayment, Tranche-based EMI)",
    "No hidden charges",
    "Interest rate same as regular home loans",
    "Tax benefits on principal and interest per Income Tax Act 1961",
    "Top-up loan facility up to ₹100 lakhs",
    "24/7 customer support via chat, WhatsApp",
    "Online loan account management",
    "Pan-India branch network",
    "Minimal documentation required",
    "Eligibility: minimum 12 months consistent repayment on existing loan",
    "Maximum tenure: 30 years or retirement age (whichever lower)",
    "For under-construction properties: tranche-based disbursement with interest-only payments initially"
  ],
  "fees_table_raw": "Processing Fee (Salaried/Self-Employed Professional): 0.50% or ₹4,000 (whichever higher); Self-Employed Non-Professional: 1.50% or ₹5,000 (whichever higher); NRI/Value Plus/HDFC Reach: 1.50-2.00% or ₹4,000-₹5,000 (whichever higher). Re-appraisal (6+ months): ₹3,300-₹5,000. Conversion fee (floating to fixed): ₹3,000. Foreclosure charges: 2% (fixed rate loans). Part-payment charges: None (adjustable rate); 2% (fixed rate, from own sources). Administrative charges: ₹5,000. Payment return: ₹450. Custody charges: ₹1,000/month (after 60 days post-closure). All charges exclusive of taxes.",
  "data_quality": {
    "completeness_pct": 0.85,
    "fields_missing": ["eligibility.salaried_min_income_inr_monthly", "eligibility.self_employed_min_income_inr_annual", "eligibility.min_credit_score", "turnaround_days.sanction", "turnaround_days.disbursal"]
  }
}
