{
  "partner_id": "hdfc-bank",
  "product_code": "home-extension-loan",
  "product_family": "EXTENSION",
  "product_name_official": "Home Extension Loans",
  "product_summary": "A loan to extend or add living space to an existing apartment, floor, or row house such as additional rooms and floors. Available for both existing and new customers.",
  "source_url": "https://homeloans.hdfc.bank.in/housing-loans/home-extension-loan",
  "scraped_at": "2026-04-27",
  "review_status": "pending",
  "review_notes": null,
  "eligibility": {
    "entity_types": ["Salaried individuals", "Self-employed professionals", "Self-employed non-professionals"],
    "min_age": 18,
    "max_age": 70,
    "salaried_min_income_inr_monthly": null,
    "self_employed_min_income_inr_annual": null,
    "min_business_vintage_years": null,
    "min_itr_years": 2,
    "min_credit_score": null,
    "geographies": ["Resident Indian"]
  },
  "pricing": {
    "roi_min_pct": 7.75,
    "roi_max_pct": 13.2,
    "roi_basis": "Policy Repo Rate + 2.50% to 7.95%",
    "processing_fee_pct_min": 0.5,
    "processing_fee_pct_max": 1.5,
    "processing_fee_flat_inr": 4000,
    "foreclosure_charges_pct": 2.0,
    "prepayment_charges_pct": 2.0,
    "other_charges_notes": "Stamp duty, CERSAI charges, mortgage guarantee, administrative charges up to Rs. 5000, non-compliance charges up to 2% p.a., conversion charges 0.50% or Rs. 3000 (whichever lower)"
  },
  "loan_structure": {
    "ltv_pct_max": 90.0,
    "tenure_months_min": 12,
    "tenure_months_max": 240,
    "ticket_inr_min": 100000,
    "ticket_inr_max": 1000000000
  },
  "collateral_accepted": ["Security interest on property being financed", "Other collateral/interim security as required"],
  "documents_required": [
    "PAN Card or Form 60",
    "Passport (non-expired)",
    "Driving license (non-expired)",
    "Election/Voters ID",
    "Aadhaar number proof",
    "Last 3 months salary slips",
    "Last 6 months bank statements",
    "Form-16 and IT returns",
    "Income Tax Returns (last 2 assessment years)",
    "Balance Sheet and P&L (last 2 years)",
    "Title deed of property",
    "Proof of no encumbrances",
    "Approved building plans",
    "Construction estimate by architect/civil engineer",
    "Own contribution proof",
    "Employment contract/appointment letter",
    "Business profile documentation",
    "Form 26 AS",
    "Shareholder details (if applicable)",
    "Partnership deed (if applicable)",
    "Details of ongoing loans",
    "Cheque for processing fee",
    "Passport-size photographs"
  ],
  "turnaround_days": { "sanction": null, "disbursal": null },
  "key_features": [
    "End-to-end digital process with loan approval in 4 steps",
    "Customised repayment options tailored to requirements",
    "Easy documentation with minimal requirements",
    "24x7 assistance via chat and WhatsApp",
    "Online loan account for convenient management",
    "Available for existing and new customers",
    "Simple monthly installment repayments",
    "Interest rates identical to home loans",
    "Tax benefits on principal and interest under Income Tax Act, 1961",
    "Disbursal in installments based on construction progress",
    "Up to 20-year tenure or till retirement age (whichever lower)",
    "Co-applicant options for higher eligibility"
  ],
  "fees_table_raw": "Processing Fee: Salaried/Self-employed Professional 0.50% or Rs. 4000 (whichever higher) + taxes; Self-employed Non-Professional 1.50% or Rs. 5000 (whichever higher) + taxes. Conversion Fees: 0.50% of outstanding principal or Rs. 3000 (whichever lower). Premature Closure: Fixed rate 2% + taxes; Variable rate NIL. Administrative: Up to Rs. 5000 + taxes. Stamp duty, CERSAI, mortgage guarantee at actuals.",
  "data_quality": {
    "completeness_pct": 0.85,
    "fields_missing": ["eligibility.salaried_min_income_inr_monthly", "eligibility.self_employed_min_income_inr_annual", "turnaround_days"]
  }
}
