{
  "partner_id": "hdfc-bank",
  "product_code": "home-loan-top-up",
  "product_family": "HOME_LOAN_TOPUP",
  "product_name_official": "Home Loan Top Up",
  "product_summary": "Additional borrowing against existing home loan for personal or professional needs like marriage, education, business expansion, or debt consolidation with minimal documentation.",
  "source_url": "https://homeloans.hdfc.bank.in/housing-loans/top-up-loans",
  "scraped_at": "2026-04-27",
  "review_status": "pending",
  "review_notes": null,
  "eligibility": {
    "entity_types": ["Salaried", "Self Employed Professional", "Self Employed Non-Professional"],
    "min_age": 18,
    "max_age": 70,
    "salaried_min_income_inr_monthly": null,
    "self_employed_min_income_inr_annual": null,
    "min_business_vintage_years": null,
    "min_itr_years": 2,
    "min_credit_score": null,
    "geographies": ["Resident Indian"]
  },
  "pricing": {
    "roi_min_pct": 8.0,
    "roi_max_pct": 13.7,
    "roi_basis": "Policy Repo Rate + 2.75% to 8.45%",
    "processing_fee_pct_min": 1.0,
    "processing_fee_pct_max": 1.0,
    "processing_fee_flat_inr": 7500,
    "foreclosure_charges_pct": 2.5,
    "prepayment_charges_pct": 2.5,
    "other_charges_notes": "Part payment charges: 2.5% + taxes for amounts exceeding 25% of principal outstanding. No charges for part prepayment up to 25% once per financial year. Premature closure charges: 2.5% for fixed rate loans. Payment return charge: Rs 450. Repayment schedule change: Rs 50 per instance (digital free). Repayment mode change: Rs 500. Custody charges: Rs 1000/month beyond 60 days. CERSAI charges: Rs 100 per property."
  },
  "loan_structure": {
    "ltv_pct_max": 80.0,
    "tenure_months_min": 12,
    "tenure_months_max": 180,
    "ticket_inr_min": null,
    "ticket_inr_max": 10000000
  },
  "collateral_accepted": ["Security interest on property being financed", "Other collateral/interim security as required by bank"],
  "documents_required": [
    "PAN Card or Form 60",
    "Passport (valid)",
    "Driving license (valid)",
    "Election/Voters identification card",
    "Job card issued by NREGA",
    "Letter from National Population Register",
    "Aadhaar number proof",
    "Last 3 months salary slips",
    "Last 6 months bank statements",
    "Latest Form-16 and IT returns",
    "Income Tax Returns for at least 2 Assessment Years",
    "Balance Sheet and Profit & Loss statements for 2 years (CA attested)",
    "Last 12 months current account statements",
    "Title deeds and previous property documents",
    "Own contribution proof",
    "Employment contract/appointment letter",
    "Passport size photographs of all applicants",
    "Cheque for processing fee",
    "Business profile",
    "Declaration for end use of loan",
    "Form 26 AS",
    "Directors and shareholders list with shareholding",
    "Memorandum and Articles of Association",
    "Partnership deed",
    "Details of ongoing loans"
  ],
  "turnaround_days": { "sanction": null, "disbursal": null },
  "key_features": [
    "End to end digital process with approval in 4 simple steps",
    "Easy documentation with minimal requirements",
    "24x7 assistance via chat, WhatsApp",
    "Online loan account management",
    "Loans up to Rs 100 lacs",
    "Attractive interest rates",
    "Available for existing customers and new Balance Transfer customers",
    "Simple monthly instalments",
    "Integrated branch network across India",
    "Can be combined with Balance Transfer facility",
    "Applicable 12 months after final disbursement of existing home loan",
    "Requires possession/completion of existing financed property",
    "Maximum tenure of 15 years or till retirement age (whichever is lower)",
    "Available for personal and professional needs excluding speculative purposes"
  ],
  "fees_table_raw": "Loan Processing Charges: Maximum 1% of loan amount (Minimum Rs 7,500). Pre-Payment/Part Payment Charges (Floating): No charges for 25% of principal outstanding once per financial year; 2.5% + taxes for amounts exceeding 25%; Nil for individual borrowers for non-business purposes; Nil for MSEs. Pre-Payment/Part Payment Charges (Fixed): Maximum 2.5% of principal outstanding; Nil after 60 months; Nil for MSEs up to Rs 50 lakh. Premature Closure (Floating-Business): 2.5% of principal outstanding; Nil after 60 months. Premature Closure (Floating-Non-Business): Nil. Premature Closure (Fixed): 2.5% + taxes of principal outstanding; Nil after 60 months. Payment Return Charges: Rs 450. Repayment Schedule Changes: Rs 50 per instance (Digital free). Repayment Mode Change: Rs 500. Custody Charges: Rs 1000/month for non-collection beyond 60 days. Revision in Spread: 0.1% of principal outstanding or Rs 5,000 whichever is higher. Stamp Duty & Statutory Charges: As per applicable laws. Conversion Charges (BPLR/Base rate/MCLR to Policy Repo Rate): Nil for existing customers. CERSAI Charges: Rs 100 per property. Property Swapping/Partial Release: 0.1% of loan amount (Min Rs 10,000, Max Rs 25,000 per property). Document Retrieval: Rs 75 per document set. Senior citizen discount: 10% on all service charges.",
  "data_quality": {
    "completeness_pct": 0.88,
    "fields_missing": ["eligibility.salaried_min_income_inr_monthly", "eligibility.self_employed_min_income_inr_annual", "turnaround_days"]
  }
}
